{
  "schema_version": "1.0.0",
  "fixture_data": true,
  "revision": 1,
  "publication_id": "publication_demo_001",
  "platform": "douyin_cn",
  "output_id": "render_output_demo_001",
  "project_id": "edit_project_demo_001",
  "project_revision": 1,
  "variant_id": "edit_variant_demo_a",
  "script_id": "script_demo_001",
  "script_version_id": "version_demo_a",
  "product_id": "product_demo_001",
  "status": "published",
  "work_url": "https://www.douyin.com/video/7600000000000000001",
  "work_id": "7600000000000000001",
  "account_label": "工程验收账号",
  "title": "肩线和纹理怎么判断",
  "published_at": "2026-08-30T01:00:00Z",
  "registered_by": "运营甲",
  "note": "隔离工程样例，不计入真实验收",
  "output_sha256": "cccccccccccccccccccccccccccccccccccccccccccccccccccccccccccccccc",
  "business_review": {"status": "pending", "reviewed_by": null, "reviewed_at": null, "note": ""},
  "history": [{"revision": 1, "action": "registered", "actor": "运营甲", "at": "2026-08-30T01:05:00Z", "note": "登记工程样例"}],
  "created_at": "2026-08-30T01:05:00Z",
  "updated_at": "2026-08-30T01:05:00Z"
}
